{"activated_at":null,"activated_by":null,"activation_ticket":null,"challengers":[],"created_at":"2026-09-16T08:09:27.123311+00:00","evidence_ids":["sha256:test"],"fallback":"NO_TRADE","incumbent":{"code_sha":"aaaaaaaaaaaaaaaaaaaaaaaaaaaaaaaaaaaaaaaaaaaaaaaaaaaaaaaaaaaaaaaa","param_hash":"9b2eb5adf6e72519","params":{"fast_period":10,"slow_period":30},"strategy_id":"ma_adx"},"policy_commit_sha":"bbbbbbbbbbbbbbbbbbbbbbbbbbbbbbbbbbbbbbbb","policy_data_manifest_sha":"cccccccccccccccccccccccccccccccccccccccccccccccccccccccccccccccc","policy_feature_manifest_sha":"dddddddddddddddddddddddddddddddddddddddddddddddddddddddddddddddd","policy_id":"380b20b916df717e7a890f15935f84c69b1a006eddcd26451bc198920794f9f1","policy_release_digest":"eeeeeeeeeeeeeeeeeeeeeeeeeeeeeeeeeeeeeeeeeeeeeeeeeeeeeeeeeeeeeeee","previous_policy_id":null,"promotion_stage":"paper_eligible","regime":"low_volatility","risk_cap":0.25,"rollback_reason":null,"scores":{"selection_score":0.5},"status":"validated","symbol":"BTC/USDT","timeframe":"1h","validity_end":"2026-12-15T08:10:27.123311+00:00","validity_start":"2026-09-15T08:10:27.123311+00:00"}