{"activated_at":null,"activated_by":null,"activation_ticket":null,"challengers":[],"created_at":"2026-09-23T20:47:52.915707+00:00","evidence_ids":["sha256:t8a-ca-chal-range_mean_reversion-mean_reversion-ETH_USDT"],"fallback":"NO_TRADE","incumbent":{"code_sha":"t8a-ca002","param_hash":"58cdf7bc11cb22f5","params":{"period":14,"std_threshold":1.5},"strategy_id":"range_mean_reversion"},"policy_commit_sha":"t8a-ca-commit","policy_data_manifest_sha":"t8a-ca-data","policy_feature_manifest_sha":"t8a-ca-feature","policy_id":"19b753d00d51bda883ce51afb0e46402366877c1f19de3c6f45d54ae8d458f8f","policy_release_digest":"sha256:t8a-ca-release","previous_policy_id":null,"promotion_stage":"paper_eligible","regime":"mean_reversion","risk_cap":0.2,"rollback_reason":null,"scores":{"median_calmar":0.4,"median_max_dd_pct":0.3,"median_oos_return_pct":0.05,"median_oos_trades":30,"median_test_sharpe":0.25,"n_passing_folds":4,"selection_score":0.4,"total_folds":9},"status":"validated","symbol":"ETH_USDT","timeframe":"daily","validity_end":"2126-08-30T20:48:52.915707+00:00","validity_start":"2020-01-01T00:00:00+00:00"}