{"activated_at":null,"activated_by":null,"activation_ticket":null,"challengers":[],"created_at":"2026-09-18T12:08:43.066814+00:00","evidence_ids":["sha256:paper-chal-ma_vol_target-other"],"fallback":"NO_TRADE","incumbent":{"code_sha":"paper002","param_hash":"3aba16d2838bca21","params":{"fast_period":10,"slow_period":30},"strategy_id":"ma_vol_target"},"policy_commit_sha":"paper-commit-sha","policy_data_manifest_sha":"paper-data-sha","policy_feature_manifest_sha":"paper-feature-sha","policy_id":"62f208d89c62ae89771e2b740d42a43f590304ee6d7c495edadf330312264449","policy_release_digest":"sha256:paper-release-digest","previous_policy_id":null,"promotion_stage":"paper_eligible","regime":"other","risk_cap":0.25,"rollback_reason":null,"scores":{"median_calmar":0.3,"median_max_dd_pct":0.4,"median_oos_return_pct":0.02,"median_oos_trades":30,"median_test_sharpe":0.2,"n_passing_folds":7,"selection_score":0.4,"total_folds":9},"status":"validated","symbol":"SOL/USDT","timeframe":"1h","validity_end":"2026-12-17T12:09:43.066814+00:00","validity_start":"2020-01-01T00:00:00+00:00"}