{"activated_at":null,"activated_by":null,"activation_ticket":null,"challengers":[],"created_at":"2026-09-16T08:15:22.562691+00:00","evidence_ids":["sha256:shadow-ma_adx-mean_reversion"],"fallback":"NO_TRADE","incumbent":{"code_sha":"aaaaaaaaaaaaaaaaaaaaaaaaaaaaaaaaaaaaaaaaaaaaaaaaaaaaaaaaaaaaaaaa","param_hash":"e02903c60e0b0904","params":{"adx_period":14,"adx_threshold":25.0,"fast_period":20,"slow_period":80},"strategy_id":"ma_adx"},"policy_commit_sha":"bbbbbbbbbbbbbbbbbbbbbbbbbbbbbbbbbbbbbbbb","policy_data_manifest_sha":"cccccccccccccccccccccccccccccccccccccccccccccccccccccccccccccccc","policy_feature_manifest_sha":"dddddddddddddddddddddddddddddddddddddddddddddddddddddddddddddddd","policy_id":"49d268eab9d750dc1eaf645ce573612822882f07358e0a7f27d63430a617742d","policy_release_digest":"eeeeeeeeeeeeeeeeeeeeeeeeeeeeeeeeeeeeeeeeeeeeeeeeeeeeeeeeeeeeeeee","previous_policy_id":null,"promotion_stage":"paper_eligible","regime":"mean_reversion","risk_cap":0.25,"rollback_reason":null,"scores":{"selection_score":0.5},"status":"validated","symbol":"BTC/USDT","timeframe":"1h","validity_end":"2026-12-15T08:16:22.562691+00:00","validity_start":"2026-09-15T08:16:22.562691+00:00"}