{"activated_at":null,"activated_by":null,"activation_ticket":null,"challengers":[],"created_at":"2026-09-22T07:52:49.932894+00:00","evidence_ids":["sha256:t8a-chal-rsi-trend"],"fallback":"NO_TRADE","incumbent":{"code_sha":"t8a002","param_hash":"9d6ee6484eb5a5a4","params":{"period":14},"strategy_id":"rsi"},"policy_commit_sha":"t8a-commit-sha","policy_data_manifest_sha":"t8a-data-sha","policy_feature_manifest_sha":"t8a-feature-sha","policy_id":"da85f4bc7ec9475aa87e52931b1221315e3c1522f0d08b8598b4a2252f1ddcd6","policy_release_digest":"sha256:t8a-release-digest","previous_policy_id":null,"promotion_stage":"paper_eligible","regime":"trend","risk_cap":0.25,"rollback_reason":null,"scores":{"median_calmar":0.4,"median_max_dd_pct":0.3,"median_oos_return_pct":0.05,"median_oos_trades":30,"median_test_sharpe":0.25,"n_passing_folds":7,"selection_score":0.4,"total_folds":9},"status":"validated","symbol":"BTC_USDT","timeframe":"daily","validity_end":"2126-08-29T07:53:49.932894+00:00","validity_start":"2020-01-01T00:00:00+00:00"}