{"activated_at":"2026-09-23T20:09:51.388302+00:00","activated_by":"t8a-cross-asset","activation_ticket":"T8A-CA-BNB_USDT-trend","challengers":[],"created_at":"2026-09-23T20:14:22.266518+00:00","evidence_ids":["sha256:t8a-ca-cross_sectional_momentum_ls-trend-BNB_USDT"],"fallback":"NO_TRADE","incumbent":{"code_sha":"t8a-ca001","param_hash":"3465b1e2a20a87f3","params":{"lookback":5,"threshold":0.02},"strategy_id":"cross_sectional_momentum_ls"},"policy_commit_sha":"t8a-ca-commit","policy_data_manifest_sha":"t8a-ca-data","policy_feature_manifest_sha":"t8a-ca-feature","policy_id":"e5c180c1a88f9f0fffff4ead68ae6f39c0d9dfc2c24369feb5e37bf3a4d91f8b","policy_release_digest":"sha256:t8a-ca-release","previous_policy_id":null,"promotion_stage":"paper_eligible","regime":"trend","risk_cap":0.2,"rollback_reason":null,"scores":{"median_calmar":0.7,"median_max_dd_pct":0.25,"median_oos_return_pct":0.1,"median_oos_trades":40,"median_test_sharpe":0.35,"n_passing_folds":5,"selection_score":0.5,"total_folds":9},"status":"expired","symbol":"BNB_USDT","timeframe":"daily","validity_end":"2126-08-30T20:09:51.388302+00:00","validity_start":"2020-01-01T00:00:00+00:00"}