{"activated_at":null,"activated_by":null,"activation_ticket":null,"challengers":[],"created_at":"2026-09-22T07:52:49.932894+00:00","evidence_ids":["sha256:t8a-chal-bbands-high_vol"],"fallback":"NO_TRADE","incumbent":{"code_sha":"t8a002","param_hash":"f388b82118a56203","params":{"period":20,"std_dev":2.0},"strategy_id":"bbands"},"policy_commit_sha":"t8a-commit-sha","policy_data_manifest_sha":"t8a-data-sha","policy_feature_manifest_sha":"t8a-feature-sha","policy_id":"820174cced4a7d923a3a0bf30a050f75179f7e3f60b18fd08d0102e15cf21224","policy_release_digest":"sha256:t8a-release-digest","previous_policy_id":null,"promotion_stage":"paper_eligible","regime":"high_vol","risk_cap":0.25,"rollback_reason":null,"scores":{"median_calmar":0.4,"median_max_dd_pct":0.3,"median_oos_return_pct":0.05,"median_oos_trades":30,"median_test_sharpe":0.25,"n_passing_folds":7,"selection_score":0.4,"total_folds":9},"status":"validated","symbol":"BTC_USDT","timeframe":"daily","validity_end":"2126-08-29T07:53:49.932894+00:00","validity_start":"2020-01-01T00:00:00+00:00"}