{"activated_at":null,"activated_by":null,"activation_ticket":null,"challengers":[],"created_at":"2026-09-23T20:08:51.388302+00:00","evidence_ids":["sha256:t8a-ca-chal-bbands-trend-ETH_USDT"],"fallback":"NO_TRADE","incumbent":{"code_sha":"t8a-ca002","param_hash":"12dc2f29f1a4ad33","params":{"period":20,"std_dev":2.0},"strategy_id":"bbands"},"policy_commit_sha":"t8a-ca-commit","policy_data_manifest_sha":"t8a-ca-data","policy_feature_manifest_sha":"t8a-ca-feature","policy_id":"5c473611124de8f5dedf88bff9c71912308d106bd7454656594030b9059952d2","policy_release_digest":"sha256:t8a-ca-release","previous_policy_id":null,"promotion_stage":"paper_eligible","regime":"trend","risk_cap":0.2,"rollback_reason":null,"scores":{"median_calmar":0.4,"median_max_dd_pct":0.3,"median_oos_return_pct":0.05,"median_oos_trades":30,"median_test_sharpe":0.25,"n_passing_folds":4,"selection_score":0.4,"total_folds":9},"status":"validated","symbol":"ETH_USDT","timeframe":"daily","validity_end":"2126-08-30T20:09:51.388302+00:00","validity_start":"2020-01-01T00:00:00+00:00"}