{"activated_at":null,"activated_by":null,"activation_ticket":null,"challengers":[],"created_at":"2026-09-23T20:21:51.601905+00:00","evidence_ids":["sha256:t8a-ca-chal-ma_adx_regime-high_vol-BTC_USDT"],"fallback":"NO_TRADE","incumbent":{"code_sha":"t8a-ca002","param_hash":"2c4f9647afc46400","params":{},"strategy_id":"ma_adx_regime"},"policy_commit_sha":"t8a-ca-commit","policy_data_manifest_sha":"t8a-ca-data","policy_feature_manifest_sha":"t8a-ca-feature","policy_id":"ad1c54cb8a3b74ac8ea0263cc36f0642bb80984a3bc430a8acb591ec87d42de1","policy_release_digest":"sha256:t8a-ca-release","previous_policy_id":null,"promotion_stage":"paper_eligible","regime":"high_vol","risk_cap":0.2,"rollback_reason":null,"scores":{"median_calmar":0.4,"median_max_dd_pct":0.3,"median_oos_return_pct":0.05,"median_oos_trades":30,"median_test_sharpe":0.25,"n_passing_folds":4,"selection_score":0.4,"total_folds":9},"status":"validated","symbol":"BTC_USDT","timeframe":"daily","validity_end":"2126-08-30T20:22:51.601905+00:00","validity_start":"2020-01-01T00:00:00+00:00"}