{"activated_at":null,"activated_by":null,"activation_ticket":null,"challengers":[],"created_at":"2026-09-23T20:08:51.388302+00:00","evidence_ids":["sha256:t8a-ca-chal-stat_arbitrage_lo-crisis-BTC_USDT"],"fallback":"NO_TRADE","incumbent":{"code_sha":"t8a-ca002","param_hash":"5f735c2d49c6d504","params":{},"strategy_id":"stat_arbitrage_lo"},"policy_commit_sha":"t8a-ca-commit","policy_data_manifest_sha":"t8a-ca-data","policy_feature_manifest_sha":"t8a-ca-feature","policy_id":"a4d422eccdef814442129d567a5c1dfbbd96c202c706f6bb5c8aa9d1f7c45b75","policy_release_digest":"sha256:t8a-ca-release","previous_policy_id":null,"promotion_stage":"paper_eligible","regime":"crisis","risk_cap":0.2,"rollback_reason":null,"scores":{"median_calmar":0.4,"median_max_dd_pct":0.3,"median_oos_return_pct":0.05,"median_oos_trades":30,"median_test_sharpe":0.25,"n_passing_folds":4,"selection_score":0.4,"total_folds":9},"status":"validated","symbol":"BTC_USDT","timeframe":"daily","validity_end":"2126-08-30T20:09:51.388302+00:00","validity_start":"2020-01-01T00:00:00+00:00"}